key	wav	txt
3660-172183-0012	data/dev-other/3660/172183/3660-172183-0012.flac	and though thou shouldst desire to see my defeat and my death by the hands of those men yet do i feel no dread
3660-172183-0024	data/dev-other/3660/172183/3660-172183-0024.flac	i go now lord said he to meet the knight and to conduct him to his lodging
3660-172183-0013	data/dev-other/3660/172183/3660-172183-0013.flac	and he received him and that not feebly
3660-172183-0010	data/dev-other/3660/172183/3660-172183-0010.flac	and he desired enid to mount her horse and to ride forward and to keep a long way before him
3660-172183-0001	data/dev-other/3660/172183/3660-172183-0001.flac	before geraint the scourge of the enemy i saw steeds white with foam and after the shout of battle a fearful torrent
3660-172183-0026	data/dev-other/3660/172183/3660-172183-0026.flac	and after they had eaten and drank geraint went to sleep and so did enid also